{
  "metadata": {
    "language": "en-US",
    "locale": "en-US",
    "direction": "LTR",
    "version": "1.0.0"
  },
  "common": {
    "menu_file": "File",
    "menu_edit": "Edit",
    "button_ok": "OK",
    "button_cancel": "Cancel"
  },
  "editor": {
    "viewport": "Viewport",
    "hierarchy": "Hierarchy"
  },
  "errors": {
    "load_failed": "Failed to load file: {0}"
  }
}
